"1109";"SR 187";"30v";"Fs";"F3";"10";"Franz Christoph Hysterle von Cadau";"1642-06-20";;"mh";;;;;"10327"
"1110";"SR 187";"30v";"Fs";"F3";"11";"Emerich Arteti Graf";"1642-12-22";;"mh";;;;;"10204"
"1111";"SR 187";"31r";"Fs";"F3";"12";"Nicolau Passman von Panes";"1644-01-01";;"mh";;;;;"10849"
"1112";"SR 187";"31r";"Fs";"F3";"13";"Ferdinand Ernst Isterle Freiherr von Cadau";"1648-03-09";;"mh";;;;;"10328"
"1113";"SR 187";"31r";"Fs";"F3";"14";"Hans Bernhard Lebel";"1648-04-01";;"mh";;;;;"11083"
"1114";"SR 187";"31r";"Fs";"F3";"15";"Franz Leopold Freiherr von Terhaimb";"1649-07-15";;"mh";;;;;"10698"
"1115";"SR 187";"31r";"Fs";"F3";"16";"Anthoni Graf Lanthöri";"1650-04-05";;"mh";;;;;"10865"
"1116";"SR 187";"31r";"Fs";"F3";"17";"Georg Christoph Broskobsky";"1651-03-29";;"mh";;;;;"10633"
"1117";"SR 187";"31r";"Fs";"F3";"18";"Gotthart Graf von Stahremberg";"1652-11-05";;"mh";;;;;"10382"
"1118";"SR 187";"31r";"Fs";"F3";"19";"Gottlob Graf von Kueffstain";"1652-11-29";;"mh";;;;;"12033"
"1119";"SR 187";"32r";"Ms";"F3";"46";"Georg Christian Graf von Saurau";"1649-02-04";;"mh";;;;;"10639"
"1120";"SR 187";"32r";"Ms";"F3";"47";"Hans Friedrich Graf von Herberstain";"1649-02-18";;"mh";;;;;"10643"
"1121";"SR 187";"32r";"Ms";"F3";"48";"Ludwig Graf von Rabata";"1649-04-04";;"mh";;;;;"10434"
"1122";"SR 187";"32r";"Ms";"F3";"49";"Ferdinand Victor Teüffel Freiherr auf Gunderstorff und Eßling";"1649-05-29";;"mh";;;;;"10172"
"1123";"SR 187";"32r";"Ms";"F3";"50";"Adam Quintin Freiherr von Hörberstain";"1649-12-07";;"mh";;;;;"10648"
"1124";"SR 187";"32r";"Ms";"F3";"51";"Ferdinand Ernst Freiherr von Herberstain";"1649-12-20";;"mh";;;;;"10649"
"1125";"SR 187";"32r";"Ms";"F3";"52";"Franz Leopold Freiherr von Tierhaimb";"1650-03-15";;"mh";;;;;"10698"
"1126";"SR 187";"32r";"Ms";"F3";"53";"Adolf Ehrenreich Graf von Buechhaimb";"1650-03-22";;"mh";;;;;"10541"
"1127";"SR 187";"32r";"Ms";"F3";"54";"Andree Graf von Zanus";"1650-09-04";;"mh";;;;;"11009"
"1128";"SR 187";"32v";"Ms";"F3";"55";"Franz Anton Graf von Trautmanstorff";"1651-03-11";;"mh";;;;;"10156"
"1129";"SR 187";"32v";"Ms";"F3";"56";"Hans Christoph Broskobski";"1651-03-29";;"mh";;;;;"10632"
"1130";"SR 187";"32v";"Ms";"F3";"57";"Albrecht Maximilian Graf de Fours";"1651-04-05";;"mh";;;;;"10552"
"1131";"SR 187";"32v";"Ms";"F3";"58";"Adam Graf Weschelin";"1651-04-20";;"mh";;;;;"10723"
"1132";"SR 187";"32v";"Ms";"F3";"59";"Georg Günther Freiherr zu Herberstain";"1651-04-24";;"mh";;;;;"10664"
"1133";"SR 187";"32v";"Ms";"F3";"60";"Valentin Balasa Freiherr";"1651-04-23";;"mh";;;;;"10206"
"1134";"SR 187";"32v";"Ms";"F3";"61";"Hans Bernhard Graf zu Herberstain";"1651-05-27";;"mh";;;;;"10659"
"1135";"SR 187";"32v";"Ms";"F3";"62";"Helmhard Christoph Ungnadt Graf von Weißenwolff";"1651-09-20";;"mh";;;;;"10166"
"1136";"SR 187";"33r";"Ms";"F3";"63";"Johann Mattthias Graf zu Strasolta";"1652-03-05";;"mh";;;;;"10852"
"1137";"SR 187";"33r";"Ms";"F3";"64";"Carl Graf Careto de Milesimo";"1652-08-11";;"mh";;;;;"10462"
"1138";"SR 187";"33r";"Ms";"F3";"65";"Vincenz Hercolani";"1652-09-07";;"mh";;;;;"10858"
"1139";"SR 187";"33r";"Ms";"F3";"66";"Hans Jochamb Graf Schlabata";"1653-06-19";;"mh";;;;;"10379"
"1140";"SR 187";"33r";"Ms";"F3";"67";"Franz Adam Larzanzki Graf Buckaoe";"1653-07-09";;"mh";;;;;"19579"
"1141";"SR 187";"33r";"Ms";"F3";"68";"Hans Albrecht Hann";"1654-03-21";;"mh";;;;;"11002"
"1142";"SR 187";"33r";"Ms";"F3";"69";"Garvasi Franziskus Äscher von Binigen";"1654-10-17";;"mh";;;;;"10549"
"1143";"SR 187";"33v";"Ms";"F3";"70";"Nicola Paravicino di Capelli et Caspon Freiherr";"1655-01-21";;"mh";;;;;"10828"
"1144";"SR 187";"33v";"Ms";"F3";"71";"Joseph Graf Turin";"1655-03-23";;"mh";;;;;"12029"
"1145";"SR 187";"33v";"Ms";"F3";"72";"Ernst Rietinger Graf von Stahremberg";"1655-06-07";;"mh";;;;;"10092"
"1146";"SR 187";"33v";"Ms";"F3";"73";"Maximilian von Wallnstain";"1655-07-20";;"mh";;;;;"10063"
"1147";"SR 187";"33v";"Ms";"F3";"74";"Johann Franz Graf von Wirmb";"1656-04-19";;"mh";;;;;"10426"
"1148";"SR 187";"33v";"Ms";"F3";"75";"Albert Heinrich Maximilian Freiherr von Kolobrath";"1656-05-15";;"mh";;;;;"10745"
"1149";"SR 187";"33v";"Ms";"F3";"76";"Michael Graf Rabata";"1656-09-24";;"mh";;;;;"10432"
"1150";"SR 187";"33v";"Ms";"F3";"77";"N Graf Tilly";"1656-09-24";;"mh";;;;;"10361"
"1151";"SR 187";"36r";"Ts";"F3";"1";"Otto Achaz Hechenfeldtner von Osterhaimb";"1634-05-01";;"mh";;;;;"10151"
"1152";"SR 187";"36r";"Ts";"F3";"2";"Matthias Khuen Graf von Liechtenberg";"1634-09-15";;"mh";;;;;"10417"
"1153";"SR 187";"36r";"Ts";"F3";"3";"Balthasar Ferdinand von Hornstain";"1634-10-15";;"mh";;;;;"10811"
"1154";"SR 187";"36r";"Ts";"F3";"4";"Ulrich Desiderio Zastrizl Freiherr";"1635-06-10";;"mh";;;;;"10546"
"1155";"SR 187";"36r";"Ts";"F3";"5";"Alexius Ferdinand Wratislaw";"1635-07-08";;"mh";;;;;"10365"
"1156";"SR 187";"36r";"Ts";"F3";"6";"Carl Hermann Götz von Dobrisch Freiherr";"1635-07-08";;"mh";;;;;"11115"
"1157";"SR 187";"36v";"Ts";"F3";"7";"Carolus von Welden";"1635-07-15";;"mh";;;;;"13101"
"1158";"SR 187";"36v";"Ts";"F3";"8";"Aloisio Graf von Castilion";"1636-04-15";;"mh";;;;;"13063"
"1159";"SR 187";"36v";"Ts";"F3";"9";"Ferdinand von Paar Freiherr";"1636-05-01";;"mh";;;;;"14095"
"1160";"SR 187";"36v";"Ts";"F3";"10";"Christoph Ernst Freiherr von Schallenberg";"1636-10-30";;"mh";;;"abweichender Vorname als Irrtum des Schreibers gewertet";;"11048"
"1161";"SR 187";"36v";"Ts";"F3";"11";"Michael Waywoda Fürst";"1636-12-22";;"mh";;;;;"10171"
"1162";"SR 187";"36v";"Ts";"F3";"12";"Hans Franziskus Dandaloth Freiherr";"1637-01-06";;"mh";;;;;"10807"
"1163";"SR 187";"36v";"Ts";"F3";"13";"Hans Albrecht Haan";"1637-01-06";;"mh";;;;;"11002"
"1164";"SR 187";"37r";"Ts";"F3";"14";"Hubertus von Tschernin Freiherr";"1637-01-21";;"mh";;;;;"10553"
"1165";"SR 187";"37r";"Ts";"F3";"15";"Bernhard von Galler";"1637-03-20";;"mh";;;;;"13107"
"1166";"SR 187";"37r";"Ts";"F3";"16";"Adauctus Konorzeoskrius";"1637-04-02";;"mh";;;;;"11047"
"1167";"SR 187";"37r";"Ts";"F3";"17";"Hans Georg Wratislaw Freiherr von Mitrawiz";"1637-04-27";;"mh";;;;;"10396"
"1168";"SR 187";"37r";"Ts";"F3";"18";"Stanislaus Wegierski";"1637-04-29";;"mh";;;;;"12103"
"1169";"SR 187";"37r";"Ts";"F3";"19";"Alexander Michael Parezwsky";"1637-04-29";;"mh";;;;;"12105"
"1170";"SR 187";"37r";"Ts";"F3";"20";"Johann Dominico Albano";"1637-04-29";;"mh";;;;;"10935"
"1171";"SR 187";"37v";"Ts";"F3";"21";"Johannes Kaniensky de Storenzoklowiz";"1637-05-01";;"mh";;;;;"12104"
"1172";"SR 187";"37v";"Ts";"F3";"22";"Stanislaus Wegierski";"1637-05-01";;"mh";;;;;"12103"
"1173";"SR 187";"37v";"Ts";"F3";"23";"Ladislaus Giulaffi de Kathet Freiherr";"1637-07-23";;"mh";;;;;"10928"
"1174";"SR 187";"37v";"Ts";"F3";"24";"Stefan Zechy";"1637-10-08";;"mh";;;;;"12107"
"1175";"SR 187";"37v";"Ts";"F3";"25";"Ferdinand von Zetliz";"1637-10-16";;"mh";;;;;"11124"
"1176";"SR 187";"37v";"Ts";"F3";"26";"Christoph Sigmund Graf von Thun";"1638-06-15";;"mh";;;;;"10025"
"1177";"SR 187";"37v";"Ts";"F3";"27";"Adauctus Wenzel Boggoranzkhi";"1638-06-05";;"mh";;;;;"11046"
"1178";"SR 187";"38r";"Ts";"F3";"28";"Wenzel Heinrich Haubiz Freiherr";"1638-06-15";;"mh";;;;;"10693"
"1179";"SR 187";"38r";"Ts";"F3";"29";"Hans Jacob von Paar Freiherr";"1638-12-29";;"mh";;;;;"14094"
"1180";"SR 187";"38r";"Ts";"F3";"30";"Hermann Heinrich von Derenbach";"1639-01-04";;"mh";;;;;"19449"
"1181";"SR 187";"38r";"Ts";"F3";"31";"Stefan Julafi Freiherr";"1639-01-28";;"mh";;;;;"10929"
"1182";"SR 187";"38r";"Ts";"F3";"32";"Johann Sigmund von Gerstorff";"1639-04-21";;"mh";;;;;"10486"
"1183";"SR 187";"38r";"Ts";"F3";"33";"Scipione Bonacossi";"1639-04-21";;"mh";;;;;"10456"
"1184";"SR 187";"38r";"Ts";"F3";"34";"Giovann Baptista Graf von Milessimo";"1639-11-01";;"mh";;;;;"10461"
"1185";"SR 187";"38v";"Ts";"F3";"35";"Johann Ludwig von Stahrnberg";"1640-10-15";;"mh";;;;;"10381"
"1186";"SR 187";"38v";"Ts";"F3";"36";"Georg Zdenko Wratislaw von Mitrawiz";"1640-11-01";;"mh";;;;;"10191"
"1187";"SR 187";"38v";"Ts";"F3";"37";"Franz Christoph Histerle von Cadau";"1641-10-18";;"mh";;;;;"10327"
"1188";"SR 187";"38v";"Ts";"F3";"38";"Jakob Ernst von Egg";"1641-01-18";;"mh";;;;;"11524"
"1189";"SR 187";"38v";"Ts";"F3";"39";"Hans Victor Graf von Wallenstain";"1641-02-10";;"mh";;;;;"10065"
"1190";"SR 187";"38v";"Ts";"F3";"40";"Hans Sebastian von Hallweill";"1641-03-18";;"mh";;;;;"19840"
"1191";"SR 187";"39r";"Ts";"F3";"41";"Franciscus Graf von Negeroll";"1641-12-09";;"mh";;;;;"10545"
"1192";"SR 187";"39r";"Ts";"F3";"42";"Wladislaus de Lukona Eukosski";"1642-05-01";;"mh";;;;;"12106"
"1193";"SR 187";"39r";"Ts";"F3";"43";"Adam Freiherr von Herberstain";"1642-10-06";;"mh";;;;;"10648"
"1194";"SR 187";"39r";"Ts";"F3";"44";"Ferdinand von Krekhowiz";"1642-11-18";;"mh";;;;;"12108"
"1195";"SR 187";"39r";"Ts";"F3";"45";"Christoph Wilhelm von Arzt";"1643-05-06";;"mh";;;;;"14071"
"1196";"SR 187";"39r";"Ts";"F3";"46";"Philip Heinrich von Sickhingen";"1643-06-16";;"mh";;;;;"15476"
"1197";"SR 187";"39v";"Ts";"F3";"47";"Franz Horezky Freiherr von Horckha";"1643-12-01";;"mh";;;;;"12123"
"1198";"SR 187";"39v";"Ts";"F3";"48";"Andree von Kuzbach";"1644-03-01";;"mh";;;;;"17619"
"1199";"SR 187";"39v";"Ts";"F3";"49";"Ludwig Friedrich Schiffer";"1644-04-05";;"mh";;;;;"11503"
"1200";"SR 187";"39v";"Ts";"F3";"50";"Leopold Franz Harandt Freiherr zu Polschüz";"1642-04-08";;"mh";;;;;"13034"
"1201";"SR 187";"39v";"Ts";"F3";"51";"Claudius Caspar de Montby";"1645-07-12";;"mh";;;;;"10939"
"1202";"SR 187";"39v";"Ts";"F3";"52";"Peter Killner von Klöten";"1645-08-10";;"mh";;;;;"11343"
"1203";"SR 187";"39v";"Ts";"F3";"53";"Bartholomäus Graf von Starhemberg";"1645-10-15";;"mh";;;;;"10359"
"1204";"SR 187";"40r";"Ts";"F3";"54";"Hans Wenzel Freiherr von Collobrath";"1646-10-26";;"mh";;;;;"10751"
"1205";"SR 187";"40r";"Ts";"F3";"55";"Daniel Revay de Reva Freiherr";"1646-12-10";;"mh";;;;;"10536"
"1206";"SR 187";"40r";"Ts";"F3";"56";"Philip Emanuel von Soye";"1647-02-22";;"mh";;;;;"13077"
"1207";"SR 187";"40r";"Ts";"F3";"57";"Franz Ernst Freiherr von Baar";"1647-03-02";;"mh";;;;;"14092"
"1208";"SR 187";"40r";"Ts";"F3";"58";"Sigmund Friedrich Freiherr von Lamberg";"1648-08-01";;"mh";;;;;"10412"
"1209";"SR 187";"40r";"Ts";"F3";"59";"N von Gerra";"1648-08-02";;"mh";;;;;"11140"
"1210";"SR 187";"40r";"Ts";"F3";"60";"Emericus Rebaey Graf Revay";"1648-08-02";;"mh";;;;;"10537"
"1211";"SR 187";"40r";"Ts";"F3";"61";"Georg Christoph Freiherr von Globiz";"1648-12-25";;"mh";;;;;"19182"
"1212";"SR 187";"40v";"Ts";"F3";"62";"Octavio von Taxis Freiherr";"1649-05-24";;"mh";;;;;"10780"
"1213";"SR 187";"40v";"Ts";"F3";"63";"Johann Carl Freiherr von Wirmb";"1649-11-19";;"mh";;;;;"10425"
"1214";"SR 187";"40v";"Ts";"F3";"64";"Anthoni Graf von Landöri";"1649-12-24";;"mh";;;;;"10865"
"1215";"SR 187";"40v";"Ts";"F3";"65";"Johann Matthias Graf zu Strasolda";"1649-12-24";;"mh";;;;;"10852"
"1216";"SR 187";"40v";"Ts";"F3";"66";"Jarislau Ferdinand Sauerma Freiherr von der Jeltsch";"1650-03-05";;"mh";;;;;"10409"
"1217";"SR 187";"40v";"Ts";"F3";"67";"Sigmund Ferdinand Cazianer Freiherr";"1650-03-20";;"mh";;;;;"11135"
"1218";"SR 187";"40v";"Ts";"F3";"68";"Ludovicus Coronin Freiherr von Croneberg";"1650-10-20";;"mh";;;;;"10325"
"1219";"SR 187";"40v";"Ts";"F3";"69";"Thoma Baraniay de Ocseny";"1651-03-11";;"mh";;;;;"10962"
"1220";"SR 187";"41r";"Ts";"F3";"70";"Hans Franz Orschiz Freiherr zu Socoll";"1651-09-20";;"mh";;;;;"11218"
"1221";"SR 187";"41r";"Ts";"F3";"71";"Wolf Sebastian Freiherr von Pötting";"1651-12-24";;"mh";;;;;"13256"
"1222";"SR 187";"41r";"Ts";"F3";"72";"Ferdinand Johann Anton Graf von Vertuga";"1652-04-15";;"mh";;;;;"10620"
"1223";"SR 187";"41r";"Ts";"F3";"73";"Ferdinand Graf Caraffa";"1652-04-06";;"mh";;;;;"10968"
"1224";"SR 187";"41r";"Ts";"F3";"74";"Gotthard Graf von Stahrenberg";"1652-11-05";;"mh";;;;;"10382"
"1225";"SR 187";"41r";"Ts";"F3";"75";"Ergott Graf von Kueffstain";"1653-01-26";;"mh";;;;;"12034"
"1226";"SR 187";"41r";"Ts";"F3";"76";"Cesare Alesandreo Hercolani";"1653-02-03";;"mh";;;;;"10859"
"1227";"SR 187";"41r";"Ts";"F3";"77";"Ferdinand Ludwig von Wopping Freiherr zu Kopfhaimb";"1653-06-15";;"mh";;;;;"14097"
"1228";"SR 187";"41r";"Ts";"F3";"78";"Peter Laubsky";"1653-06-26";;"mh";;;;;"12127"
"1229";"SR 187";"41v";"Ts";"F3";"79";"Johann Weikhardt Kazianer Freiherr von Kazenstain";"1653-06-27";;"mh";;;;;"11128"
"1230";"SR 187";"41v";"Ts";"F3";"80";"Christoph Wertschain";"1653-12-05";;"mh";;;;;"11141"
"1231";"SR 187";"41v";"Ts";"F3";"81";"Wenzel Carl Zabelizki Freiherr von Ehet";"1654-01-21";;"mh";;;;;"12126"
"1232";"SR 187";"41v";"Ts";"F3";"82";"Franz Dominicus Graf zu Heisenstain";"1654-04-11";;"mh";;;;;"11159"
"1233";"SR 187";"41v";"Ts";"F3";"83";"Octavius Graf Cazaldo";"1654-06-16";;"mh";;;;;"10906"
"1234";"SR 187";"41v";"Ts";"F3";"84";"Franciscus von Wintischgräz";"1654-06-18";;"mh";;;;;NULL
"1235";"SR 187";"41v";"Ts";"F3";"85";"Albertus Latislau Otcolec";"1654-07-21";;"mh";;;;;"11089"
"1236";"SR 187";"41v";"Ts";"F3";"86";"Johann Franz Graf von Messerati";"1654-09-05";;"mh";;;;;"10799"
"1237";"SR 187";"41v";"Ts";"F3";"87";"Johann Parbian Welciossa";"1654-09-05";;"mh";;;;;"10855"
"1238";"SR 187";"42r";"Ts";"F3";"88";"Georg Christoph de Wangeregg";"1655-02-25";;"mh";;;;;"10729"
"1239";"SR 187";"42r";"Ts";"F3";"89";"Bartholomäus Carolus Lug(us) Praslin";"1655-05-27";;"mh";;;;;NULL
"1240";"SR 187";"42r";"Ts";"F3";"90";"Johann Mauriz Prasma Graf von Bilnau";"1655-07-28";;"mh";;;;;"11303"
"1241";"SR 187";"42r";"Ts";"F3";"91";"Gabriel Graf von Sarbelani";"1655-08-12";;"mh";;;;;"10926"
"1242";"SR 187";"42r";"Ts";"F3";"92";"Wolf Vincenz Freiherr von Wazenberg";"1655-12-11";;"mh";;;;;"14099"
"1243";"SR 187";"42r";"Ts";"F3";"93";"Julius Carl Podstazki";"1656-01-04";;"mh";;;;;"19248"
"1244";"SR 187";"42r";"Ts";"F3";"94";"Andre Bartholomäus Gatta";"1656-03-15";;"mh";;;;;"14893"
"1245";"SR 187";"42r";"Ts";"F3";"95";"Franz von Gondola";"1657-02-13";;"mh";;;;;"15676"
"1246";"SR 187";"46r";"OSilK";"F3";"1";"Bernhard Graf von Marteniz";"1637-04-20";;"mh";;;;;"10176"
"1247";"SR 187";"46r";"OSilK";"F3";"2";"Friedrich Wilhelm von Thallenberg Freiherr";"1639-09-22";;"mh";;;;;"10182"
"1248";"SR 187";"46r";"OSilK";"F3";"3";"Maximilian Graf von Marteniz";"1642-10-15";;"mh";;;;;"10180"
"1249";"SR 187";"46r";"OSilK";"F3";"4";"Franz Ernst Freiherr von Mollart";"1644-05-23";;"mh";;;;;"10186"
"1250";"SR 187";"46r";"OSilK";"F3";"5";"Franz Christoph Isterl Freiherr von Catau";"1647-08-21";;"mh";;;;;"10327"
"1251";"SR 187";"47r";"USilK";"F3";"1";"Johann de Aviles";"1636-01-15";;"mh";;;;;"10895"
"1252";"SR 187";"47r";"USilK";"F3";"2";"Jaroslaw Ferdinand Sauerma Freiherr von und zu der Jeltsch";"1651-06-20";;"mh";;;;;"10409"
"1253";"SR 187";"52r";"H";"F3";"2";"Francesco Flisola";"1641-03-17";;"mh";"Würckliche Besoldte Hoffdienner";;;;"13055"
"1254";"SR 187";"52r";"H";"F3";"3";"Peter Abel Schmalz";"1642-01-01";"1642-10-16";"mh";"Würckliche Besoldte Hoffdienner";;;;"11312"
"1256";"SR 187";"52r";"H";"F3";"4";"Georg von Plettenberg";"1642-04-04";;"mh";"Würckliche Besoldte Hoffdienner";;;;"11105"
"1257";"SR 187";"52r";"R";"F3";"1";"Foppius Freiherr von Assena";"1637-07-15";;"mh";"Würckliche Besoldte Hoffdienner (und Räth)";;"nachgetragen";;"17938"
"1258";"SR 187";"52r";"R";"F3";"2";"Franz Lisola";"1641-03-17";;"mh";"Würckliche Besoldte Hoffdienner (und Räth)";"hier ausdrücklich als Rath gekennzeichnet";"nachgetragen";;"13055"
"1259";"SR 187";"52r";"R";"F3";"3";"Peter Abel Schmalz";"1642-02-05";;"mh";"Würckliche Besoldte Hoffdienner (und Räth)";"hier ausdrücklich als Rath gekennzeichnet";"als Doublette nachgetragen";;"11312"
"1260";"SR 187";"52r";"R";"F3";"4";"Georg von Platenberg";"1642-04-04";;"mh";"Würckliche Besoldte Hoffdienner (und Räth)";"hier ausdrücklich als Rath gekennzeichnet";"als Doublette nachgetragen";;"11105"
"1261";"SR 187";"56r";"HKaSek";"F3";"1";"Leopold Eissen";"1637-04-02";;"mh";;;;;"11100"
"1262";"SR 187";"56r";"HKaSek";"F3";"2";"Georg Wagner";"1637-04-02";;"mh";;;;;"11419"
"1263";"SR 187";"56r";"HKaSek";"F3";"3";"Reinoldt von Runggen";;;"mh";;;;"1637-04-02";"11145"
"1264";"SR 187";"56r";"HKaSek";"F3";"4";"Johann Carl von Aichpüchel";"1640-04-01";;"mh";;;;;"31101"
"1265";"SR 187";"56r";"HKaSek";"F3";"5";"Marco Puz";"1640-12-05";;"mh";;;;;"11052"
"1267";"SR 187";"70r";"HVC";"F3";"1";"Johann Mathias Prückhlmayr";"1637-04-02";;"mh";;"Österreichischer Vizekanzler";;;"10796"
"1268";"SR 187";"?";"HKrSek";"F3";"1";"Johann Philip von Khnillenberg";"1637-03-01";;"mh";;;;;"11313"
"1269";"SR 187";"?";"HKrSek";"F3";"2";"Johann Friedrich Vischer";"1637-04-02";;"mh";;;;;"11314"
"1270";"SR 187";"?";"HKrSek";"F3";"3";"Johann Georg Puecher";"1637-04-02";;"mh";;;;;"11188"
"1271";"SR 187";"?";"HKrSek";"F3";"4";"Johann Baptista Khiellman";"1637-04-02";;"mh";;;;;"11327"
"1272";"SR 187";"?";"HKrSek";"F3";"5";"Franz Mosmüller";"1638-05-16";;"mh";;;;;"11328"
"1273";"SR 187";"?";"HKrSek";"F3";"6";"Ferdinand Wittmer";"1640-05-20";;"mh";;;;;"11329"
"1274";"SR 187";"?";"HKrSek";"F3";"7";"Francesco Usseri";"1642-07-21";;"mh";;;"Entlassung";;"11333"
"1275";"SR 187";"?";"HKrSek";"F3";"8";"Peter Abel Schmalz";"1642-10-16";;"mh";;;;;"11312"
"1276";"SR 187";"100r";"HarHM";"F3";"1";"Philip Graf von Mansfeldt";"1637-10-01";;"mh";;;;;"10146"
"1277";"SR 187";"100r";"HarHM";"F3";"2";"Hans Christoph von Römerstall";"1634-03-15";;"mh";;;;;"11160"
"1278";"SR 187";"100r";"HarHM";"F3";"3";"Octavio Piccolomini";"1639-02-15";;"mh";;;;;"10072"
"1279";"SR 187";"100r";"HarHM";"F3";"4";"Leopold Wilhelm Markgraf von Baaden";"1656-08-16";;"mh";;;;;"10350"
"1280";"SR 187";"105r";"TraHM";"F3";"1";"Walter Lesele";"1634-03-15";;"mh";;;;;"10027"
"1281";"SR 187";"105r";"TraHM";"F3";"2";"Hans Christoph von Römersthall";"1633-01-01";;"mh";;;;;"11160"
"1282";"SR 187";"105r";"TraHM";"F3";"3";"Ferdinand Friedrich Graf von Fürstenberg";"1651-01-01";;"mh";;;;;"10168"
"1283";"SR 187";"109r";"OKüM";"F3";"1";"Hans Wilhelm Herr von Cronegg Freiherr";"1634-03-01";;"mh";"Hofküchenmeister";;;;"10484"
"1284";"SR 187";"109r";"OKüM";"F3";"2";"Franz Ernst Freiherr von Mollart";"1646-10-01";;"mh";"Hofküchenmeister";;;;"10186"
"1287";"SR 187";"140r";"HZM";"F3";"1";"Christoph Castele";"1637-04-02";;"mh";;;;;"11003"
"1288";"SR 187";"140r";"HZM";"F3";"2";"Thoman Edter zu Khainpach";"1639-02-11";;"mh";;;;;"31163"
"1289";"SR 187";"154r";"OFalkM";"F3";"1";"Georg Achaz Graf zu Lossentain";"1637-04-02";;"mh";;;;;"10093"
"1290";"SR 187";"154r";"OFalkM";"F3";"2";"Franz Albrecht Graf von Harrach";"1642-11-01";;"mh";;;;;"10096"
"1291";"SR 187";"157r";"HKrQM";"F3";"1";"Christoph Ulrich von Puz";"1635-04-20";;"mh";;;;;"14036"
"1292";"SR 187";"189r";"K";"F3";"0";"Johann Rudolf Graf von Buechhaimb";"1625-01-01";;"mh";;;;;"10076"
"1293";"SR 187";"190r";"K";"F3";"1";"Sigmund Friedrich Ratkhay Freiherr";"1634-04-02";;"mh";;;;;"12135"
"1294";"SR 187";"190r";"K";"F3";"2";"Michael Johann Graf von Althamb";"1635-01-01";;"mh";;;;;"10901"
"1295";"SR 187";"190r";"K";"F3";"3";"Georg Friedrich von Hochen Zollern Freiherr";"1636-10-21";;"mh";;;"zu korrigieren auf 21. Oktober 1626";;"10028"
"1296";"SR 187";"190r";"K";"F3";"4";"Johann Ulrich Graf von Slawata";;;"mh";;;;;"10256"
"1297";"SR 187";"190r";"K";"F3";"5";"Ulrich Adam Poppel Graf";;;"mh";;;;;"10057"
"1298";"SR 187";"190r";"K";"F3";"6";"Niclas Trasconiz";;;"mh";;;;"1625";"11007"
"1299";"SR 187";"190r";"K";"F3";"7";"Franciseo Darochi De Perghino";"1632-03-19";;"mh";;;;;"12165"
"1300";"SR 187";"190v";"K";"F3";"8";"Wolfgang von Stubenberg Freiherr";"1632-04-19";;"mh";;;;;"13037"
"1301";"SR 187";"190v";"K";"F3";"9";"Hans Maximilian von Lamberg Freiherr";"1634-03-10";;"mh";;;;;"10084"
"1302";"SR 187";"190v";"K";"F3";"10";"Walter Lesele";"1634-03-15";;"mh";;;;;"10027"
"1303";"SR 187";"190v";"K";"F3";"11";"Wratislaw Graf von Fürstenberg";"1634-12-26";;"mh";;;;;"10221"
"1304";"SR 187";"190v";"K";"F3";"12";"Don Juan Giron";"1636-02-25";;"mh";;;;;"12502"
"1305";"SR 187";"190v";"K";"F3";"13";"Johann Adolf von Schwarzenberg";"1637-01-02";;"mh";;;;;"10045"
"1306";"SR 187";"190v";"K";"F3";"14";"Hermann Graf von Zschernin";"1637-01-03";;"mh";;;;;"10538"
"1307";"SR 187";"190v";"K";"F3";"15";"Achaz Graf von Losenstain";"1637-04-05";;"mh";;;;;"10093"
"1308";"SR 187";"191r";"K";"F3";"16";"Wenzel Graf von Wirmb";"1637-04-06";;"mh";;;;;"10145"
"1309";"SR 187";"191r";"K";"F3";"17";"Christoph Teifel Freiherr";"1637";;"mh";;;;;"10136"
"1310";"SR 187";"191r";"K";"F3";"18";"Franciscus Graf Picollomini";"1637";;"mh";;;;;"10839"
"1311";"SR 187";"191r";"K";"F3";"19";"Georg Friedrich Graf von Hochenzollern";"1626-10-21";;"mh";;;;;"10028"
"1312";"SR 187";"191r";"K";"F3";"20";"Berchtoldt von Wallenstain Freiherr";"1627-05-01";;"mh";;;;;"10062"
"1313";"SR 187";"191r";"K";"F3";"21";"Hans Sigmundt von Thun Freiherr";"1627-05-01";;"mh";;;;;"10007"
"1314";"SR 187";"191r";"K";"F3";"22";"Ulrich Franz Freiherr von Kollawradt";"1629-01-15";;"mh";;;;;"10122"
"1315";"SR 187";"191v";"K";"F3";"23";"Heinrich Johann Sbubna Freiherr";"1637-04-11";;"mh";;;;;"10008"
"1316";"SR 187";"191v";"K";"F3";"24";"Bruno Graf von Mansfeldt";"1637-04-17";;"mh";;;;;"10015"
"1317";"SR 187";"191v";"K";"F3";"25";"Sigmund Forgatsch Graf";"1638-01-17";;"mh";;;;;"10197"
"1318";"SR 187";"191v";"K";"F3";"26";"Christoph Wratislaw von Mitrowiz";"1638-08-25";;"mh";;;;;"10369"
"1319";"SR 187";"191v";"K";"F3";"27";"Ernst von Thraun";"1639-04-04";;"mh";;;;;"11505"
"1320";"SR 187";"191v";"K";"F3";"28";"Wurian Ladislaw Graf von Wallenstain";"1639-05-04";;"mh";;;;;"10064"
"1321";"SR 187";"191v";"K";"F3";"29";"Adam Matthias Graf von Trautmanstorff";"1639-06-08";;"mh";;;;;"10158"
"1322";"SR 187";"192r";"K";"F3";"30";"Johann Arbogas Graf von Thun";"1640-06-19";;"mh";;;;;"10148"
"1323";"SR 187";"192r";"K";"F3";"31";"Martin Franz Graf zu Öttingen";"1640-09-12";;"mh";;;;;"10604"
"1324";"SR 187";"192r";"K";"F3";"32";"Franz Albrecht von Harrach";"1640-09-20";;"mh";;;;;"10096"
"1325";"SR 187";"192r";"K";"F3";"33";"Albrecht von Zinsendorff Freiherr";"1640-12-15";;"mh";;;;;"10164"
"1326";"SR 187";"192r";"K";"F3";"34";"Johann Jakob Graf von Zeill";"1641-07-07";;"mh";;;;;"10177"
"1327";"SR 187";"192r";"K";"F3";"35";"Franz Wilhelm von Tallenberg Freiherr";"1641-07-07";;"mh";;;;;"10182"
"1328";"SR 187";"192r";"K";"F3";"36";"Wenzeslaw Eusebius Fürst von Lockhowiz";"1641-08-11";;"mh";;;"Eidleistung am 15. Juni 1644";;"10058"
"1329";"SR 187";"192v";"K";"F3";"37";"Ladislaus Tschackhy Graf";"1642-01-02";;"mh";;;;;"12074"
"1330";"SR 187";"192v";"K";"F3";"38";"Carl Gottfried Preiner Freiherr";"1642-05-11";;"mh";;;;;"10187"
"1331";"SR 187";"192v";"K";"F3";"39";"Gottfried Freiherr von Eybeswaldt";"1642-05-17";;"mh";;;;;"11142"
"1332";"SR 187";"192v";"K";"F3";"40";"Hieronymus Graf Monteguguli";"1642-07-16";;"mh";;;;;"10894"
"1333";"SR 187";"192v";"K";"F3";"41";"Hans Wilhelm von Schäfftenberg Freiherr";"1642-12-14";;"mh";;;;;"10440"
"1334";"SR 187";"192v";"K";"F3";"42";"David Ungnadt Freiherr";"1642-12-31";;"mh";;;;;"10165"
"1335";"SR 187";"192v";"K";"F3";"43";"Johann Friedrich Graf von Trautmanstorf";"1643-01-02";;"mh";;;;;"10129"
"1336";"SR 187";"193r";"K";"F3";"44";"Ferdinand Marquese de Grana";"1643-01-18";;"mh";;;;;"10398"
"1337";"SR 187";"193r";"K";"F3";"45";"Christopher Balduin Graf von Zenezia";"1643-04-02";;"mh";;;;;"11087"
"1338";"SR 187";"193r";"K";"F3";"46";"Georg Ludwig Freiherr von Stahrnberg";"1643-05-04";;"mh";;;;;"10383"
"1339";"SR 187";"193r";"K";"F3";"47";"Ferdinand Ernst Graf von Wallnstain";"1643-05-24";;"mh";;;;;"10061"
"1340";"SR 187";"193r";"K";"F3";"48";"Emerich Artedi Graf";"1643-09-01";;"mh";;;;;"10204"
"1341";"SR 187";"193r";"K";"F3";"49";"Johann Christoph Graf von Buechhaimb";"1643-12-18";;"mh";;;;;"10077"
"1342";"SR 187";"193v";"K";"F3";"50";"Albert Gaston Spinola Graf zue Bruay";"1644-01-25";;"mh";;;;;"10921"
"1343";"SR 187";"193v";"K";"F3";"51";"Franciso Graf Natasti";"1644-02-13";;"mh";;;;;"10199"
"1344";"SR 187";"193v";"K";"F3";"52";"Maximilian Graf von Marteniz";"1644-03-20";;"mh";;;;;"10180"
"1345";"SR 187";"193v";"K";"F3";"53";"Joseph Graf Piccolomini";"1644-03-20";;"mh";;;;;"10845"
"1346";"SR 187";"193v";"K";"F3";"54";"Konrad Balthasar Graf von Starnberg";"1644-06-30";;"mh";;;;;"10356"
"1347";"SR 187";"193v";"K";"F3";"55";"Johann Reichhardt Graf von Stahrnberg";"1644-08-28";;"mh";;;;;"10384"
"1348";"SR 187";"193v";"K";"F3";"56";"Johann Ambrosius Graf von Thurn";"1644-08-28";;"mh";;;;;"10185"
"1349";"SR 187";"194r";"K";"F3";"57";"Graf Joseph von Rabata";"1645-04-12";;"mh";;;;;"10189"
"1350";"SR 187";"194r";"K";"F3";"58";"Raimund Graf Mantaggugulli";"1645-07-22";;"mh";;;;;"10888"
"1351";"SR 187";"194r";"K";"F3";"59";"Franz Ernst Freiherr von Mollar";"1645-08-02";;"mh";;;;;"10186"
"1352";"SR 187";"194r";"K";"F3";"60";"Ferdinand Graf von Partio";"1645-10-09";;"mh";;;;;"10083"
"1353";"SR 187";"194r";"K";"F3";"61";"Johann Ludwig Graf von Stahrnberg";"1645-10-29";;"mh";;;;;"10381"
"1354";"SR 187";"194r";"K";"F3";"62";"Wolf Adam Graf von Pappenhamb";"1646-02-11";;"mh";;;;;"10069"
"1355";"SR 187";"194r";"K";"F3";"63";"Christoph Paul Graf zu Liechtenstain";"1646-04-18";;"mh";;;;;"10915"
"1356";"SR 187";"194r";"K";"F3";"64";"Ott Ehrenreich Graf von Trautmanstorff";"1646-04-22";;"mh";;;;;"10157"
"1357";"SR 187";"194r";"K";"F3";"65";"Heinrich Wolf Bercka Graf von Howora";"1646-08-04";;"mh";;;;;"13029"
"1358";"SR 187";"194v";"SM";"F3";"1";"Maximilian Bosso";"1637-03-20";;"mh";;;;;"34578"
"1359";"SR 187";"194v";"SM";"F3";"2";"Matthias von Pallingen";"1640-05-01";;"mh";"ab 1642-09-01 zusätzlich monatlich 60 Gulden als Cammer Rathsbesoldung verwilliget worden";;;;"14049"
"1360";"SR 187";"195r";"Kd";"F3";"1";"Georg Ladtner";"1635-04-02";;"mh";;;;;"34370"
"1361";"SR 187";"195r";"Kd";"F3";"2";"Gotthard Rainacher";"1635-12-01";;"mh";;;;;NULL
"1362";"SR 187";"195r";"Kd";"F3";"3";"Stefan Muschliz";"1635-12-01";;"mh";;;;;"19849"
"1363";"SR 187";"195r";"Kd";"F3";"4";"Georg Friedrich Struckhl";"1637-04-06";;"mh";;;;;NULL
"1364";"SR 187";"195v";"Kd";"F3";"5";"Lukas Kuniz";"1637-11-20";;"mh";;;;;NULL
"1365";"SR 187";"195v";"Kd";"F3";"6";"Anton Haymb";"1637-11-20";;"mh";;;;;NULL
